{
    "$schema": "http://json-schema.org/draft-07/schema#",
    "type": "object",
    "required": [
        "module_id",
        "module_title",
        "module_description",
        "learning_path",
        "concepts",
        "key_takeaways"
    ],
    "properties": {
        "module_id": {
            "type": "string",
            "description": "Unique identifier for the module"
        },
        "module_title": {
            "type": "string",
            "description": "Title of the module"
        },
        "module_description": {
            "type": "string",
            "description": "Brief description of what will be learned"
        },
        "learning_path": {
            "type": "string",
            "description": "ID of the learning path this module belongs to"
        },
        "progress_percentage": {
            "type": "number",
            "minimum": 0,
            "maximum": 100,
            "description": "Current progress through the module"
        },
        "concepts": {
            "type": "array",
            "minItems": 1,
            "maxItems": 5,
            "description": "Array of concepts covered in this module",
            "items": {
                "type": "object",
                "required": [
                    "title",
                    "explanation",
                    "metaphor",
                    "technical_example",
                    "quiz"
                ],
                "properties": {
                    "title": {
                        "type": "string",
                        "description": "Title of the concept"
                    },
                    "explanation": {
                        "type": "string",
                        "description": "Clear explanation of the core concept"
                    },
                    "metaphor": {
                        "type": "object",
                        "required": ["title", "description"],
                        "properties": {
                            "title": {
                                "type": "string",
                                "description": "Title of the metaphor"
                            },
                            "description": {
                                "type": "string",
                                "description": "Detailed metaphor explanation"
                            },
                            "points": {
                                "type": "array",
                                "items": {
                                    "type": "string"
                                },
                                "description": "Key comparison points"
                            }
                        }
                    },
                    "technical_example": {
                        "type": "string",
                        "description": "Code example demonstrating the concept"
                    },
                    "quiz": {
                        "type": "object",
                        "required": ["question", "options", "correct"],
                        "properties": {
                            "question": {
                                "type": "string",
                                "description": "Quiz question text"
                            },
                            "options": {
                                "type": "object",
                                "minProperties": 2,
                                "maxProperties": 4,
                                "description": "Answer options with keys a, b, c, d",
                                "patternProperties": {
                                    "^[a-d]$": {
                                        "type": "string"
                                    }
                                }
                            },
                            "correct": {
                                "type": "string",
                                "pattern": "^[a-d]$",
                                "description": "Correct answer key"
                            },
                            "explanation": {
                                "type": "string",
                                "description": "Explanation of the correct answer"
                            }
                        }
                    }
                }
            }
        },
        "key_takeaways": {
            "type": "array",
            "minItems": 1,
            "maxItems": 5,
            "description": "Key points to remember from the module",
            "items": {
                "type": "string"
            }
        },
        "prev_module": {
            "type": ["string", "null"],
            "description": "ID of the previous module, if any"
        },
        "next_module": {
            "type": ["string", "null"],
            "description": "ID of the next module, if any"
        }
    }
}
