{
    "module_id": "dls-001",
    "module_title": "Neural Networks Fundamentals",
    "module_description": "Master the foundational concepts of neural networks, including network architecture, activation functions, forward propagation, and the basics of training neural networks.",
    "learning_path": "deep-learning-specialist",
    "progress_percentage": 0,
    "concepts": [
        {
            "title": "Neural Network Architecture",
            "explanation": "A neural network is composed of layers of interconnected nodes (neurons) that process and transform information. The basic structure includes an input layer, one or more hidden layers, and an output layer, with each neuron connected to neurons in adjacent layers.",
            "metaphor": {
                "title": "The Corporate Hierarchy",
                "description": "Think of a neural network like a company's organizational structure. Information flows from entry-level employees (input layer) through various departments (hidden layers) to executives (output layer). Each employee (neuron) processes information and passes it to the next level, with the strength of connections representing how much influence each piece of information has.",
                "points": [
                    "Entry-level employees represent input neurons receiving raw data",
                    "Department managers represent hidden layer neurons processing information",
                    "Executives represent output neurons making final decisions",
                    "Communication channels represent weights between neurons"
                ]
            },
            "technical_example": "import torch\nimport torch.nn as nn\n\nclass SimpleNeuralNetwork(nn.Module):\n    def __init__(self, input_size, hidden_size, output_size):\n        super(SimpleNeuralNetwork, self).__init__()\n        # First layer (input -> hidden)\n        self.layer1 = nn.Linear(input_size, hidden_size)\n        # Second layer (hidden -> output)\n        self.layer2 = nn.Linear(hidden_size, output_size)\n        \n    def forward(self, x):\n        # Forward pass through the network\n        hidden = self.layer1(x)\n        output = self.layer2(hidden)\n        return output\n\n# Create a network with 2 inputs, 3 hidden neurons, and 1 output\nmodel = SimpleNeuralNetwork(input_size=2, hidden_size=3, output_size=1)",
            "quiz": {
                "question": "What is the primary purpose of hidden layers in a neural network?",
                "options": {
                    "a": "To store the input data",
                    "b": "To transform and extract features from the data",
                    "c": "To save memory during computation",
                    "d": "To speed up the training process"
                },
                "correct": "b",
                "explanation": "Hidden layers transform input data into increasingly complex and abstract features, allowing the network to learn hierarchical representations of the data."
            }
        },
        {
            "title": "Activation Functions",
            "explanation": "Activation functions introduce non-linearity into neural networks, allowing them to learn complex patterns. They determine whether and to what extent a neuron should be activated, transforming the input signal into an output signal.",
            "metaphor": {
                "title": "The Office Worker's Decision Threshold",
                "description": "Think of activation functions like an office worker deciding whether to escalate information to their supervisor. Different workers might use different criteria (activation functions) - some might use a simple yes/no threshold (step function), others might grade the importance on a scale (sigmoid), and some might pass along information more freely while filtering out only the clearly irrelevant (ReLU).",
                "points": [
                    "Step function is like a strict yes/no decision",
                    "Sigmoid is like rating importance from 0 to 1",
                    "ReLU is like ignoring negative feedback and passing positive feedback unchanged",
                    "Different functions suit different types of decisions"
                ]
            },
            "technical_example": "import torch\nimport torch.nn as nn\nimport torch.nn.functional as F\n\nclass ActivationExamples(nn.Module):\n    def __init__(self):\n        super(ActivationExamples, self).__init__()\n    \n    def forward(self, x):\n        # ReLU activation\n        relu_output = F.relu(x)\n        \n        # Sigmoid activation\n        sigmoid_output = torch.sigmoid(x)\n        \n        # Tanh activation\n        tanh_output = torch.tanh(x)\n        \n        # Leaky ReLU\n        leaky_relu_output = F.leaky_relu(x, negative_slope=0.01)\n        \n        return {\n            'relu': relu_output,\n            'sigmoid': sigmoid_output,\n            'tanh': tanh_output,\n            'leaky_relu': leaky_relu_output\n        }",
            "quiz": {
                "question": "Why is ReLU (Rectified Linear Unit) commonly used in modern neural networks?",
                "options": {
                    "a": "It's the most mathematically complex activation function",
                    "b": "It helps prevent the vanishing gradient problem and is computationally efficient",
                    "c": "It always outputs values between 0 and 1",
                    "d": "It's the only differentiable activation function"
                },
                "correct": "b",
                "explanation": "ReLU is popular because it helps prevent vanishing gradients (by allowing strong gradients when active) and is computationally efficient (requiring only a simple max operation)."
            }
        },
        {
            "title": "Forward Propagation",
            "explanation": "Forward propagation is the process of passing input data through a neural network to generate predictions. Each layer applies weights, biases, and activation functions to transform the data, with information flowing from input to output.",
            "metaphor": {
                "title": "The Assembly Line",
                "description": "Think of forward propagation like an assembly line in a factory. Raw materials (input data) enter the line and pass through various workstations (layers). At each station, workers (neurons) perform specific operations (weights and activations) on the materials, gradually transforming them into the final product (output).",
                "points": [
                    "Raw materials represent input data",
                    "Workstations represent network layers",
                    "Worker operations represent weights and activations",
                    "Final product represents the network's prediction"
                ]
            },
            "technical_example": "import torch\nimport torch.nn as nn\n\nclass ForwardPropExample(nn.Module):\n    def __init__(self):\n        super(ForwardPropExample, self).__init__()\n        self.layer1 = nn.Linear(2, 3)\n        self.layer2 = nn.Linear(3, 1)\n        self.relu = nn.ReLU()\n        \n    def forward(self, x):\n        # First layer transformation\n        z1 = self.layer1(x)\n        # First layer activation\n        a1 = self.relu(z1)\n        \n        # Second layer transformation\n        z2 = self.layer2(a1)\n        # Final output\n        output = torch.sigmoid(z2)\n        \n        return output\n\n# Example usage\nmodel = ForwardPropExample()\ninput_data = torch.tensor([[0.5, 0.8]])\nprediction = model(input_data)",
            "quiz": {
                "question": "What happens during forward propagation?",
                "options": {
                    "a": "The network updates its weights",
                    "b": "The network processes input data layer by layer to produce an output",
                    "c": "The network calculates error gradients",
                    "d": "The network optimizes its parameters"
                },
                "correct": "b",
                "explanation": "Forward propagation is the process where input data flows through the network layer by layer, with each layer applying its transformations to produce the final output."
            }
        }
    ],
    "key_takeaways": [
        "Neural networks are composed of layers of interconnected neurons that process and transform information",
        "Activation functions introduce non-linearity, allowing networks to learn complex patterns",
        "Forward propagation is the process of passing data through the network to generate predictions",
        "Different activation functions serve different purposes and have unique characteristics"
    ],
    "prev_module": null,
    "next_module": "dls-002"
}
